[
 {
  "protocol": "tinyman",
  "timestamp": "2026-09-08T14:30:00.000Z",
  "as_of": "2026-09-08T14:30:00.000Z",
  "source": [
   {
    "name": "nodely-indexer",
    "url": "https://mainnet-idx.4160.nodely.dev/v2/accounts?application-id=1002541853&limit=1000&exclude=assets%2Ccreated-assets%2Ccreated-apps",
    "kind": "onchain",
    "retrieved_at": "2026-09-08T14:30:00.000Z",
    "app_id": 1002541853,
    "round": 64855600
   },
   {
    "name": "nodely-indexer",
    "url": "https://mainnet-idx.4160.nodely.dev/v2/accounts?application-id=1002541853&limit=1000&exclude=assets%2Ccreated-assets%2Ccreated-apps&next=1",
    "kind": "onchain",
    "retrieved_at": "2026-09-08T14:30:00.000Z",
    "app_id": 1002541853,
    "round": 64855600
   },
   {
    "name": "tinyman-analytics",
    "url": "https://mainnet.analytics.tinyman.org/api/v1/pools/?limit=1000&offset=0",
    "kind": "rest",
    "retrieved_at": "2026-09-08T14:30:00.000Z"
   },
   {
    "name": "tinyman-analytics",
    "url": "https://mainnet.analytics.tinyman.org/api/v1/pools/?limit=1000&offset=1000",
    "kind": "rest",
    "retrieved_at": "2026-09-08T14:30:00.000Z"
   },
   {
    "name": "tinyman-analytics",
    "url": "https://mainnet.analytics.tinyman.org/api/v1/assets/?ids=2537013734,1134696561,3203964481,2726252423,1237529510,2494786278,3160000000,2200000000,1821328783,1868885560,507472097,3081853135,2507779296,3109829078,2611535339,3581842047,2158527144,700965019,2611139760,3045159053,796425061,940424110,2155822658,3495558025,3214347764,1185173782,246516580,2582294183,3121954282,958277442,958280887,958279733,958278659,1194470385,923640017,2656265475,2578650960,1127347774,908935728,2217970766,1034994881,3616156711,2561491694,2933499000,3196313859,2935126632,2563959048,2290945144,757039174,2450411553&limit=50",
    "kind": "rest",
    "retrieved_at": "2026-09-08T14:30:00.000Z"
   },
   {
    "name": "tinyman-analytics",
    "url": "https://mainnet.analytics.tinyman.org/api/v1/assets/?ids=3122010543,3032713424,1294383366,1709999153,2211824164,1882181253,3451065491,2290771151,1069525391,2663780228,3622148694,2698002005,557264326,1055710698,1055700240,1639491796,1010838509,1821123863,1110901083,1096302088,2342621554,511028589,1285683351,3148132803,401752010,2972980000,1790688562,251014570,772212313,665182012,1110926942,1096015467,1189970332,1138500612,230946361,3178895177,797798846,2368676403,1272918363,2200421096,2154668640,2466866698,1453520040,408898501,1691271561,1065092715,1268830233,1377252601,583878846,553937591&limit=50",
    "kind": "rest",
    "retrieved_at": "2026-09-08T14:30:00.000Z"
   },
   {
    "name": "tinyman-analytics",
    "url": "https://mainnet.analytics.tinyman.org/api/v1/assets/?ids=582932609,1291176442,1248226674,1448358943,1306013327,1130414707,760037151,1448363298,1812382524,689171215,287867876,1138709032,758448815&limit=13",
    "kind": "rest",
    "retrieved_at": "2026-09-08T14:30:00.000Z"
   },
   {
    "name": "tinyman-analytics",
    "url": "https://mainnet.analytics.tinyman.org/api/v1/pools/2PIFZW53RHCSFSYMCFUBW4XOCXOMB7XOYQSQ6KGT3KVGJTL4HM6COZRNMM/",
    "kind": "rest",
    "retrieved_at": "2026-09-08T14:30:00.000Z"
   },
   {
    "name": "tinyman-analytics",
    "url": "https://mainnet.analytics.tinyman.org/api/v1/pools/XE2VD23URF632SDAHABF4VDYLZ54UGLSNSURQWB7PI3XJUN55DY64RLWXQ/",
    "kind": "rest",
    "retrieved_at": "2026-09-08T14:30:00.000Z"
   },
   {
    "name": "tinyman-analytics",
    "url": "https://mainnet.analytics.tinyman.org/api/v1/pools/VVBWRAJ3YSZGXBGJ2K654J3WA2VZOJW5U4SJCZWLM634H572WTGWTT53EE/",
    "kind": "rest",
    "retrieved_at": "2026-09-08T14:30:00.000Z"
   },
   {
    "name": "tinyman-analytics",
    "url": "https://mainnet.analytics.tinyman.org/api/v1/pools/FKMV6GSU57764TQ5NLSBEDXNPUXL7OAOKANVDP2A6FSB77BHI3GTWHQAZA/",
    "kind": "rest",
    "retrieved_at": "2026-09-08T14:30:00.000Z"
   },
   {
    "name": "tinyman-analytics",
    "url": "https://mainnet.analytics.tinyman.org/api/v1/pools/GRBADGJPWTG5LRGEICN3OJJ3PHNCY5Y5DV3D5LF4C2WJWLLZFCCWRW7ECA/",
    "kind": "rest",
    "retrieved_at": "2026-09-08T14:30:00.000Z"
   },
   {
    "name": "tinyman-analytics",
    "url": "https://mainnet.analytics.tinyman.org/api/v1/pools/J7CN6WTMUWXY2KODKAMM5BLZ42FEIQLM4D32FRQ23VOOJC2SEUHKE565T4/",
    "kind": "rest",
    "retrieved_at": "2026-09-08T14:30:00.000Z"
   },
   {
    "name": "tinyman-analytics",
    "url": "https://mainnet.analytics.tinyman.org/api/v1/pools/2XY23CF5I7E7DA7S56DOBQFIZR7AIFCS6P6TM275QADCZVWNJCDSE37AUM/",
    "kind": "rest",
    "retrieved_at": "2026-09-08T14:30:00.000Z"
   },
   {
    "name": "tinyman-analytics",
    "url": "https://mainnet.analytics.tinyman.org/api/v1/pools/LIHQGEOPOTMQKAJMXUJP2BT4R4AX4FPUC2SLBLYT27K536CA3XUQJVXE3Y/",
    "kind": "rest",
    "retrieved_at": "2026-09-08T14:30:00.000Z"
   },
   {
    "name": "tinyman-analytics",
    "url": "https://mainnet.analytics.tinyman.org/api/v1/pools/PFILVNLKQHTY47ODLTO5QF4CTMV534U5LBZLT3YOHOJNHHOLHS2H725LKY/",
    "kind": "rest",
    "retrieved_at": "2026-09-08T14:30:00.000Z"
   },
   {
    "name": "tinyman-analytics",
    "url": "https://mainnet.analytics.tinyman.org/api/v1/pools/EGXXS23IL5H34OOVBIAU4OU73GF3U425SLVQ6A66DABPU2JG4MH7WGV374/",
    "kind": "rest",
    "retrieved_at": "2026-09-08T14:30:00.000Z"
   },
   {
    "name": "tinyman-analytics",
    "url": "https://mainnet.analytics.tinyman.org/api/v1/pools/VBZKJBZ327JB6KYCEDTJU5GORANNRLP6XVGVDXPBIP34IDVLELUEWDVE3A/",
    "kind": "rest",
    "retrieved_at": "2026-09-08T14:30:00.000Z"
   },
   {
    "name": "tinyman-analytics",
    "url": "https://mainnet.analytics.tinyman.org/api/v1/pools/HHDWSEYBFMKLEUC6ZNHUK4AAKXJMSVK4NQFKO7JFB4OEHRAS4SJ32LOTVA/",
    "kind": "rest",
    "retrieved_at": "2026-09-08T14:30:00.000Z"
   },
   {
    "name": "tinyman-analytics",
    "url": "https://mainnet.analytics.tinyman.org/api/v1/pools/A7GGOADGPDSO4TN3FQGWJHTHX2X3SUPOPNN2BWL4FOVWMONBREAAJL7FTM/",
    "kind": "rest",
    "retrieved_at": "2026-09-08T14:30:00.000Z"
   },
   {
    "name": "tinyman-analytics",
    "url": "https://mainnet.analytics.tinyman.org/api/v1/pools/MEMMHYXM4B2GLYNA4PJXOPIO3SMKMFVX62UK5Y7ZKQXZXCPCIGEEEH7YBQ/",
    "kind": "rest",
    "retrieved_at": "2026-09-08T14:30:00.000Z"
   },
   {
    "name": "tinyman-analytics",
    "url": "https://mainnet.analytics.tinyman.org/api/v1/pools/E3ZI374FPIVWED6VEXPGQQW7IGSDTMW3ES5S2FQF2NBPS4K3KXTT2IFM7Y/",
    "kind": "rest",
    "retrieved_at": "2026-09-08T14:30:00.000Z"
   },
   {
    "name": "tinyman-analytics",
    "url": "https://mainnet.analytics.tinyman.org/api/v1/pools/LUFKONGMUEUBBBSB4VAU7TFSZYTR5MFQRKKRPNVINYXL2HKYDGEQ2HPOFI/",
    "kind": "rest",
    "retrieved_at": "2026-09-08T14:30:00.000Z"
   },
   {
    "name": "tinyman-analytics",
    "url": "https://mainnet.analytics.tinyman.org/api/v1/pools/DJIP7MVWAAJKTPDG7SEH64OD4QIZMRHOH5LYHY4YXWRZRG6YMD2ERJ4C2Q/",
    "kind": "rest",
    "retrieved_at": "2026-09-08T14:30:00.000Z"
   },
   {
    "name": "tinyman-analytics",
    "url": "https://mainnet.analytics.tinyman.org/api/v1/pools/6NAKH5IVZGBDTDEETKV6SLBJNDHZZASX2YO2CUPESH2IPRBN3LSKCH4E2M/",
    "kind": "rest",
    "retrieved_at": "2026-09-08T14:30:00.000Z"
   },
   {
    "name": "tinyman-analytics",
    "url": "https://mainnet.analytics.tinyman.org/api/v1/pools/SCONGCDJWPZ7U5TN5BQRWVRFWX4AO37YAS7QNGZWW6637P247IE6ZT7QHQ/",
    "kind": "rest",
    "retrieved_at": "2026-09-08T14:30:00.000Z"
   },
   {
    "name": "tinyman-analytics",
    "url": "https://mainnet.analytics.tinyman.org/api/v1/pools/RASMRI2TS7OQWKBDSGV6ERIQOQDQUAZ45R4TZ4BJOHRNNXXH6LWWEXJ2SQ/",
    "kind": "rest",
    "retrieved_at": "2026-09-08T14:30:00.000Z"
   },
   {
    "name": "tinyman-analytics",
    "url": "https://mainnet.analytics.tinyman.org/api/v1/pools/IR6B7DJTTXWWWT63ZXU2V5DQTVFFKGFTBVGGYUNVHFUONWWPQEYL3QKGQQ/",
    "kind": "rest",
    "retrieved_at": "2026-09-08T14:30:00.000Z"
   },
   {
    "name": "tinyman-analytics",
    "url": "https://mainnet.analytics.tinyman.org/api/v1/pools/AIR4CSC54U33WCX4JTMJA4X6PHBVG7OGX7XVV2MCACYSSDULZNJ2KNGRZI/",
    "kind": "rest",
    "retrieved_at": "2026-09-08T14:30:00.000Z"
   },
   {
    "name": "tinyman-analytics",
    "url": "https://mainnet.analytics.tinyman.org/api/v1/pools/JZOICSITVDITWATNW7Z43TFRJV2PGOBKAIJOJDPZXSYQZZOJY2WEOY7IC4/",
    "kind": "rest",
    "retrieved_at": "2026-09-08T14:30:00.000Z"
   },
   {
    "name": "tinyman-analytics",
    "url": "https://mainnet.analytics.tinyman.org/api/v1/pools/4K4FPT5MXWIAZZOA75P7GC5UY6BKUBLYPULO6Y3JQL3QJVLYT2DN7EY3KI/",
    "kind": "rest",
    "retrieved_at": "2026-09-08T14:30:00.000Z"
   },
   {
    "name": "tinyman-analytics",
    "url": "https://mainnet.analytics.tinyman.org/api/v1/pools/YULJFZDZ542FXZGFO6KY5T4MS2BAWOJPHNS5M3CKQ5GQXATI6LSIAPYYEY/",
    "kind": "rest",
    "retrieved_at": "2026-09-08T14:30:00.000Z"
   },
   {
    "name": "tinyman-analytics",
    "url": "https://mainnet.analytics.tinyman.org/api/v1/pools/P3OYRTHNLAL6E6IKVOGKHKQBUCKC2W3JHCL3ITYI2OULSXC6QQTJOONITA/",
    "kind": "rest",
    "retrieved_at": "2026-09-08T14:30:00.000Z"
   },
   {
    "name": "tinyman-analytics",
    "url": "https://mainnet.analytics.tinyman.org/api/v1/pools/2ISUNTWI35PNSDZDCIDLIEWBUSKWNPOPKORAIZL7MGLY7REHZTL6IKKXIQ/",
    "kind": "rest",
    "retrieved_at": "2026-09-08T14:30:00.000Z"
   },
   {
    "name": "tinyman-analytics",
    "url": "https://mainnet.analytics.tinyman.org/api/v1/pools/EWBJXKHQJM5Z5PYZG5BKXMD2AF3HKTFN7JLCI2HEGEOWO7KMBGGDW4ANXQ/",
    "kind": "rest",
    "retrieved_at": "2026-09-08T14:30:00.000Z"
   },
   {
    "name": "tinyman-analytics",
    "url": "https://mainnet.analytics.tinyman.org/api/v1/pools/DXNPQA2OFO2PKGP4LOY2GLMYZP4X6TZNXJEJKSJAKAGOUV7I2XGETEBVRY/",
    "kind": "rest",
    "retrieved_at": "2026-09-08T14:30:00.000Z"
   },
   {
    "name": "tinyman-analytics",
    "url": "https://mainnet.analytics.tinyman.org/api/v1/pools/J52F73O4RVX3ZLOZZ7DCRXSTLUJJ56TMRQKDNCEUKGVNUEFSTS7VEGH4YE/",
    "kind": "rest",